{
  "$schema": "https://json-schema.org/draft/2020-12/schema",
  "$id": "https://coregentis.org/schemas/v1.0/Learn.schema.json",
  "version": "1.0.0",
  "title": "MPLP.Learn Schema",
  "description": "Schema for representing learning processes, feedback, and strategy evolution in multi-agent environments.",
  "type": "object",
  "properties": {
    "learningId": {
      "type": "string",
      "description": "Unique identifier for the learning record."
    },
    "relatedExecutionId": {
      "type": "string",
      "description": "Execution instance that triggered the learning process."
    },
    "agentId": {
      "type": "string",
      "description": "Agent undergoing learning."
    },
    "observations": {
      "type": "array",
      "description": "List of observations or signals collected during/after execution.",
      "items": {
        "type": "string"
      }
    },
    "failureReason": {
      "type": "string",
      "description": "Optional reason or root cause of failure, if applicable."
    },
    "adjustments": {
      "type": "array",
      "description": "List of changes made to the agent's behavior, parameters, or strategy.",
      "items": {
        "type": "object",
        "properties": {
          "target": {
            "type": "string",
            "description": "What component/behavior is being adjusted."
          },
          "changeType": {
            "type": "string",
            "enum": ["parameter", "workflow", "tool", "strategy"],
            "description": "Type of adjustment."
          },
          "description": {
            "type": "string",
            "description": "Explanation of the change."
          }
        },
        "required": ["target", "changeType"]
      }
    },
    "knowledge": {
      "type": "object",
      "description": "Optional updated knowledge or learned representation stored by the agent."
    },
    "timestamp": {
      "type": "string",
      "format": "date-time",
      "description": "Time of learning completion or update."
    }
  },
  "required": ["learningId", "relatedExecutionId", "agentId", "observations", "timestamp"],
  "additionalProperties": true
}